{
  "_type": "https://in-toto.io/Statement/v0.1",
  "subject": [{"name": "_", "digest": {"sha256": "5678..."}}],
  "predicateType": "https://slsa.dev/provenance/v0.2",
  "predicate": {
    "buildType": "https://example.com/Makefile",
    "builder": { "id": "mailto:person@example.com" },
    "invocation": {
      "configSource": {
        "uri": "https://example.com/example-1.2.3.tar.gz",
        "digest": {"sha256": "1234..."},
        "entryPoint": "src:foo"
      },
      "parameters": {"CFLAGS": "-O3"}
    },
    "materials": [{
      "uri": "https://example.com/example-1.2.3.tar.gz",
      "digest": {"sha256": "1234..."}
    }]
  }
}
